{
  "contract_version": "tarot_position_semantics_v1",
  "locale": "ru",
  "roles": [
    {
      "role_id": "gain",
      "purpose": "Показать, что даёт выбранный путь или вариант: ресурс, облегчение, перспективу.",
      "answers_question": "Что открывает или даёт этот путь / вариант?",
      "extract_from_card": "Выдели светлую / ресурсную грань карты как выгоду конкретного варианта — не как общий совет.",
      "do_not": [
        "не превращай в инструкцию «сделай так»",
        "не смешивай выгоду с риском той же карты",
        "не описывай общий позитив карты вне контекста варианта"
      ],
      "result_type": "resource_gain",
      "short_instruction": "Позиция про то, что даёт путь / ресурс / облегчение — не совет «сделай так»."
    },
    {
      "role_id": "resource",
      "purpose": "Назвать внутренний или внешний ресурс, на который можно опереться.",
      "answers_question": "Какой ресурс здесь доступен?",
      "extract_from_card": "Переведи символику в опору, рычаг или качество, которое уже есть / можно усилить.",
      "do_not": [
        "не выдавай ресурс за гарантированный исход",
        "не превращай в длинный список абстрактных «сил»",
        "не подменяй ресурс советом-действием"
      ],
      "result_type": "resource_gain",
      "short_instruction": "Позиция про доступный ресурс / опору — не итог и не приказ."
    },
    {
      "role_id": "risk",
      "purpose": "Выявить конкретную опасность выбранного варианта или ситуации.",
      "answers_question": "Где цена ошибки или уязвимость этого пути?",
      "extract_from_card": "Покажи, как тень / ловушка карты может проявиться именно здесь — как риск варианта, не как общий негатив.",
      "do_not": [
        "не превращай в общий негатив карты",
        "не выдавай совет вместо риска",
        "не морализируй и не пугай фатализмом"
      ],
      "result_type": "concrete_risk",
      "short_instruction": "Позиция про конкретную опасность пути — не совет и не мораль."
    },
    {
      "role_id": "blocks",
      "purpose": "Показать, что мешает, тормозит или держит в застревании.",
      "answers_question": "Что блокирует движение или ясность?",
      "extract_from_card": "Назови препятствие через символику карты: страх, паттерн, условие — без общих жалоб.",
      "do_not": [
        "не смешивай блок с следующим шагом",
        "не своди всё к «ты сам виноват»",
        "не описывай блок как неизбежный рок"
      ],
      "result_type": "concrete_risk",
      "short_instruction": "Позиция про то, что мешает — не совет и не итог."
    },
    {
      "role_id": "warning",
      "purpose": "Сигнал осторожности: где легко потерять границы, ясность или уважение к себе.",
      "answers_question": "О чём важно предупредить до действия?",
      "extract_from_card": "Сформулируй предупреждение как наблюдаемый риск поведения / динамики, связанный с картой.",
      "do_not": [
        "не превращай в категоричное пророчество",
        "не подменяй предупреждение планом действий",
        "не раздувай тревогу без конкретики"
      ],
      "result_type": "warning_signal",
      "short_instruction": "Позиция-предупреждение: конкретный сигнал, не фатализм."
    },
    {
      "role_id": "hidden_cause",
      "purpose": "Высветить скрытый слой: неочевидную причину, слепую зону или подповерхностный фактор.",
      "answers_question": "Что влияет, но пока неочевидно?",
      "extract_from_card": "Возьми из карты то, что обычно прячется: мотив, недосказанность, самообман, внешний фактор вне фокуса.",
      "do_not": [
        "не выдавай догадку за установленный факт о другом человеке",
        "не повторяй уже явное из соседних позиций",
        "не превращай в мистическую «тайну ради тайны»"
      ],
      "result_type": "hidden_cause",
      "short_instruction": "Позиция про скрытое влияние — гипотеза с опорой на карту, не обвинение."
    },
    {
      "role_id": "next_step",
      "purpose": "Преобразовать символику в одно уместное действие сейчас.",
      "answers_question": "Какое действие уместно сейчас?",
      "extract_from_card": "Переведи карту в конкретный, выполнимый шаг в реальности (с критерием или сроком, если уместно).",
      "do_not": [
        "не описывай повторно состояние пользователя",
        "не предсказывай гарантированный результат",
        "не давай абстрактный совет без действия",
        "не пересказывай значение карты вместо шага"
      ],
      "result_type": "concrete_action",
      "short_instruction": "Позиция про действие в реальности — не описание настроения."
    },
    {
      "role_id": "advice",
      "purpose": "Дать установку / рамку поведения, которая держит баланс.",
      "answers_question": "Какая установка помогает держать курс?",
      "extract_from_card": "Сформулируй принцип из карты: как держаться, на что опираться — короче, чем полный план шагов.",
      "do_not": [
        "не подменяй совет длинным списком задач",
        "не морализируй",
        "не обещай исход"
      ],
      "result_type": "advice_frame",
      "short_instruction": "Позиция-совет: принцип / установка, не прогноз."
    },
    {
      "role_id": "outcome",
      "purpose": "Очертить вероятный итог / направление при текущем выборе — без фатализма.",
      "answers_question": "К чему может привести текущая линия, если продолжить её логику?",
      "extract_from_card": "Покажи качество итога через карту: форма завершения, начало цикла, цена — как тенденция, не приговор.",
      "do_not": [
        "не гарантируй результат",
        "не подменяй итог советом",
        "не описывай только настроение вместо формы результата"
      ],
      "result_type": "likely_outcome",
      "short_instruction": "Позиция-итог: тенденция результата, не приговор и не совет."
    },
    {
      "role_id": "past",
      "purpose": "Показать корень / предпосылку, которая сформировала текущий узел.",
      "answers_question": "Что из прошлого всё ещё формирует ситуацию?",
      "extract_from_card": "Считай карту как уже случившийся вклад или паттерн, который тянется в настоящее.",
      "do_not": [
        "не превращай прошлое в оправдание бездействия",
        "не читай как будущий прогноз",
        "не пересказывай биографию без связи с вопросом"
      ],
      "result_type": "time_context",
      "short_instruction": "Позиция-прошлое: корень влияния, не совет."
    },
    {
      "role_id": "present",
      "purpose": "Зафиксировать, что активно прямо сейчас.",
      "answers_question": "Что проявляется в динамике прямо сейчас?",
      "extract_from_card": "Опиши текущий режим карты: что уже в игре, без прыжка в итог или шаг.",
      "do_not": [
        "не подменяй настоящее советом «что делать»",
        "не уходи в отдалённое будущее",
        "не размывай в общие слова о «энергии»"
      ],
      "result_type": "time_context",
      "short_instruction": "Позиция-настоящее: что активно сейчас, не шаг и не итог."
    },
    {
      "role_id": "future",
      "purpose": "Показать открывающееся направление при текущем векторе.",
      "answers_question": "Какое направление открывается впереди?",
      "extract_from_card": "Читай как возможное продолжение линии, зависящее от выбора — не как календарное событие.",
      "do_not": [
        "не датируй и не обещай факты",
        "не подменяй будущее готовым next_step",
        "не путай с неизбежным роком"
      ],
      "result_type": "time_context",
      "short_instruction": "Позиция-будущее: направление тенденции, не факт и не приказ."
    },
    {
      "role_id": "weights",
      "purpose": "Выделить то, что нельзя игнорировать при решении.",
      "answers_question": "Что обязательно учесть, прежде чем выбирать?",
      "extract_from_card": "Сформулируй ограничение, ценность или условие из карты как вес на весах решения.",
      "do_not": [
        "не превращай в однобокий совет «выбирай A»",
        "не дублируй риск/выгоду соседних позиций дословно",
        "не морализируй"
      ],
      "result_type": "consideration",
      "short_instruction": "Позиция про то, что нельзя игнорировать при решении."
    },
    {
      "role_id": "focus",
      "purpose": "Задать линзу внимания для всего ответа на вопрос.",
      "answers_question": "На что важно посмотреть в связи с вопросом?",
      "extract_from_card": "Выдели центральный конфликт / тему карты как фокус разбора, а не полный расклад-лекция.",
      "do_not": [
        "не разворачивай энциклопедию карты",
        "не уходи от вопроса пользователя",
        "не выдавай фокус за гарантированный исход"
      ],
      "result_type": "focus_lens",
      "short_instruction": "Позиция-фокус: линза внимания к вопросу, не прогноз."
    },
    {
      "role_id": "support",
      "purpose": "Показать поддерживающие факторы «за».",
      "answers_question": "Что работает в пользу ситуации?",
      "extract_from_card": "Назови поддержку через карту: условие, качество, внешний/внутренний фактор «за».",
      "do_not": [
        "не смешивай поддержку с риском",
        "не обещай успех",
        "не подменяй поддержку планом шагов"
      ],
      "result_type": "support_factor",
      "short_instruction": "Позиция про поддержку / факторы «за»."
    },
    {
      "role_id": "nuance",
      "purpose": "Удержать зону, где жёсткий ответ потерял бы правду.",
      "answers_question": "Где ответ не может быть бинарным без потери смысла?",
      "extract_from_card": "Покажи неоднозначность или условие через карту — что зависит от контекста.",
      "do_not": [
        "не прячь за нюансом отказ отвечать",
        "не размывай до пустой воды",
        "не противоречь прямому ответу без причины"
      ],
      "result_type": "nuance",
      "short_instruction": "Позиция-нюанс: условие / неоднозначность, не уход от ответа."
    },
    {
      "role_id": "self",
      "purpose": "Описать сигнал / позицию спрашивающего в динамике.",
      "answers_question": "Какой сигнал ты (спрашивающий) посылаешь в ситуацию?",